<?xml version="1.0"?>
<config xmlns="http://uv.mx/hlimon"
xmlns:xsi="http://www.w3.org/2001/XMLSchema-instance"
xsi:schemaLocation="http://uv.mx/hlimon sys.xsd">

<name>centralized J48</name>

<agents>
  <agent>
    <program>contactPerson</program>
    <file>../sampleProtocols/centralizedj48/contactPerson.asl</file>
  </agent>
</agents>

<params>
  <param>
    <name>Pruning</name>
    <type>boolean</type>
  </param>
</params>

</config>
