<?xml version="1.0" encoding="UTF-8" standalone="no"?><config xmlns="http://uv.mx/hlimon" xmlns:xsi="http://www.w3.org/2001/XMLSchema-instance" xsi:schemaLocation="http://uv.mx/hlimon sys.xsd"><server><ip>192.168.0.100</ip></server><clients><client><name>c1</name><ip>localhost:8080</ip><file>/tmp/train1</file></client></clients><protocol><file>/home/xl666/Dropbox/doctorado/tesis/sistema/src/sampleProtocols/centralized/centralized.xml</file></protocol><distribution><agents><type>linker</type><client>c1</client><number>1</number></agents></distribution><evaluation><name>Cross-Validation</name><typeDataSource>Round files</typeDataSource><params><param><name>dataSet</name><value>/home/xl666/datasets/australian.arff</value><type>string</type></param><param><name>folds</name><value>10</value><type>int</type></param><param><name>repetitions</name><value>10</value><type>int</type></param><param><name>testPath</name><value>/tmp/test</value><type>string</type></param></params></evaluation></config>