<?xml version="1.0"?>
<config xmlns="http://uv.mx/hlimon"
xmlns:xsi="http://www.w3.org/2001/XMLSchema-instance"
xsi:schemaLocation="http://uv.mx/hlimon sys.xsd">

<name>Bagging Ensemble</name>

<agents>
  <agent>
    <program>contactPerson</program>
    <file>../sampleProtocols/baggingEnsemble/contactPerson.asl</file>
  </agent>
   <agent>
    <program>bagger</program>
    <file>../sampleProtocols/baggingEnsemble/bagger.asl</file>
  </agent>
</agents>
  <params>
    <param>
      <name>Models per node</name>
      <type>int</type>
    </param>
    <param>
      <name>Threads per node</name>
      <type>int</type>
    </param>
    <param>
      <name>Classifier</name>
      <type>string</type>
    </param>
    <param>
      <name>Classifier parameters</name>
      <type>string</type>
    </param>
  </params>

</config>
