<?xml version="1.0"?>
<config xmlns="http://uv.mx/hlimon"
xmlns:xsi="http://www.w3.org/2001/XMLSchema-instance"
xsi:schemaLocation="http://uv.mx/hlimon sys.xsd">

<name>Splitting</name>

<agents>
  <agent>
    <program>contactPerson</program>
    <file>../sampleProtocols/splitting/contactPerson.asl</file>
  </agent>
   <agent>
    <program>splitter</program>
    <file>../sampleProtocols/splitting/splitter.asl</file>
  </agent>
</agents>
  <params>
    <param>
      <name>Threads per node</name>
      <type>int</type>
    </param>
    <param>
      <name>Classifier</name>
      <type>string</type>
    </param>
    <param>
      <name>Stratify</name>
      <type>boolean</type>
    </param>
  </params>
</config>
